{
  "$schema": "https://json-schema.org/draft/2020-12/schema",
  "type": "object",
  "properties": {
    "name": {
      "type": "string",
      "minLength": 1,
      "pattern": "^[a-z0-9]+(?:-[a-z0-9]+)*$"
    },
    "version": {
      "type": "string",
      "pattern": "^(0|[1-9]\\d*)\\.(0|[1-9]\\d*)\\.(0|[1-9]\\d*)(?:-[0-9A-Za-z.-]+)?(?:\\+[0-9A-Za-z.-]+)?$"
    },
    "description": {
      "type": "string"
    },
    "author": {
      "type": "object",
      "properties": {
        "name": {
          "type": "string",
          "minLength": 1
        },
        "email": {
          "type": "string"
        },
        "url": {
          "type": "string"
        }
      },
      "required": [
        "name"
      ],
      "additionalProperties": {}
    },
    "homepage": {
      "type": "string"
    },
    "repository": {
      "type": "string"
    },
    "license": {
      "type": "string"
    },
    "keywords": {
      "type": "array",
      "items": {
        "type": "string"
      }
    },
    "commands": {
      "anyOf": [
        {
          "type": "string"
        },
        {
          "type": "array",
          "items": {
            "type": "string"
          }
        }
      ]
    },
    "agents": {
      "type": "array",
      "items": {
        "type": "string"
      }
    },
    "skills": {
      "anyOf": [
        {
          "type": "string"
        },
        {
          "type": "array",
          "items": {
            "type": "string"
          }
        }
      ]
    },
    "hooks": {
      "anyOf": [
        {
          "type": "string"
        },
        {}
      ]
    },
    "mcpServers": {
      "anyOf": [
        {
          "type": "string"
        },
        {
          "type": "object",
          "propertyNames": {
            "type": "string"
          },
          "additionalProperties": {}
        }
      ]
    },
    "outputStyles": {
      "anyOf": [
        {
          "type": "string"
        },
        {
          "type": "array",
          "items": {
            "type": "string"
          }
        }
      ]
    },
    "lspServers": {
      "anyOf": [
        {
          "type": "string"
        },
        {}
      ]
    }
  },
  "required": [
    "name"
  ],
  "additionalProperties": {}
}
