{
  "name": "epistemics",
  "version": "0.7.0",
  "description": "Judgment discipline: elicitation grilling before work starts, premortems on agreed plans, falsification passes, adversarial review, crux identification, post-answer discernment nudges, live-source verification, durable research",
  "author": {
    "name": "Dakota"
  },
  "license": "MIT",
  "keywords": [
    "claude-code",
    "skills"
  ]
}
