{
  "name": "agent-voice",
  "version": "0.3.0",
  "description": "How the agent talks: terse takeaway-last chat replies, summary-first files, one-line command reports — plus guided per-repo setup of those rules as managed instruction blocks",
  "author": {
    "name": "Dakota"
  },
  "license": "MIT",
  "keywords": [
    "claude-code",
    "skills"
  ]
}
