{
  "name": "engineering-core",
  "version": "0.5.0",
  "description": "Engineering workflow orchestrators: specs, surveys, decisions, post-mortems, guided setup wizards — plus the information-architecture, doc-visuals, prose-hygiene, readme-authoring, and skill-authoring disciplines they compose",
  "author": {
    "name": "Dakota"
  },
  "license": "MIT",
  "keywords": [
    "claude-code",
    "skills"
  ]
}
